{
  "schema_version": "0.1.0",
  "environment": "test",
  "fixture_only": true,
  "observation_id": "observation.fixture-candidates-disconnected-001",
  "tool_call_id": "tool-call.fixture-generate-disconnected-001",
  "run_id": "agent-run.fixture-outcome-001",
  "session_id": "planning-session.fixture-outcome-001",
  "base_session_revision": 1,
  "tool_registry_id": "tool-registry.agent-v0",
  "tool_registry_version": "0.1.0",
  "tool_name": "planning.generate_candidate_plans",
  "tool_version": "0.1.0",
  "capability_id": "plan.draft.create",
  "observation_kind": "candidate_plan_set",
  "result_status": "disconnected",
  "result_code": "TOOL_DISCONNECTED",
  "domain_reason_code": "DOMAIN_SERVICE_DISCONNECTED",
  "observed_at": "2026-08-03T20:10:00+08:00",
  "observation_only": true,
  "raw_provider_payload_exposed": false,
  "exact_coordinates_exposed": false,
  "canonical_fact_claimed": false,
  "result_refs": [],
  "warning_refs": ["warning.fixture-domain-disconnected-001"],
  "unknown_refs": [],
  "retry_disposition": "DEFER",
  "user_safe_summary": "领域服务暂时不可用，未产生候选。",
  "metadata": {"x-fixture": true, "x-synthetic": true}
}
